### ISSUE TITLE
Punt path is broken in invader TX direction

### ISSUE THREAD

**Issue by donnlee** [platinasystems/go#9]
Version:
```
donn@invader8:~/workspace/gitlab.com/donnlee/tor/invader/testing/punt_path$ /usr/bin/goes version
71edbc1d0d43cdeb99cd618db30d0cb33d8ef355
```
which is:
```
commit 71edbc1d0d43cdeb99cd618db30d0cb33d8ef355
Author: Tom Grennan <tgrennan@platinasystems.com>
Date:   Fri Dec 30 17:34:31 2016 -0800
```

Test setup is back-to-back i8 and i14, 100Gb copper cable.  i14 is running pktgen:
i8:eth-29-0-------100g------i14:eth1.129

I have a script that does a scp transfer of a 500MB .iso file between them and loops forever.
i8 initiates the scp transfers and downloads .iso file from i14.

scp loop cmd:
```
donn@invader8:~/workspace/gitlab.com/donnlee/tor/invader/testing/punt_path$ while ./scp_loop.py : ; do sleep 1; done > ~/scp_loop_$(date "+%Y_%m_%d_%H%M").log 2>&1
```

My script starts at:
```
Starting file xfer test at Fri Jan  6 11:14:24 PST 2017:
Transferred: sent 98980, received 548027552 bytes, in 2.0 seconds
Bytes per second: sent 48616.1, received 269175072.6
Done with file xfer at Fri Jan  6 11:14:26 PST 2017.
```

About 13 hours later, the scp file transfer fails starting at: Sat Jan  7 00:29:30 PST 2017
```
Starting file xfer test at Sat Jan  7 00:29:24 PST 2017:
Transferred: sent 98900, received 548027552 bytes, in 1.7 seconds
Bytes per second: sent 59514.7, received 329784662.9
Done with file xfer at Sat Jan  7 00:29:26 PST 2017.

Starting file xfer test at Sat Jan  7 00:29:27 PST 2017:
Transferred: sent 98920, received 548027552 bytes, in 1.6 seconds
Bytes per second: sent 61817.6, received 342476312.0
Done with file xfer at Sat Jan  7 00:29:29 PST 2017.

Starting file xfer test at Sat Jan  7 00:29:30 PST 2017:
Done with file xfer at Sat Jan  7 00:45:13 PST 2017.

Starting file xfer test at Sat Jan  7 00:45:14 PST 2017:
Done with file xfer at Sat Jan  7 00:45:17 PST 2017.

Starting file xfer test at Sat Jan  7 00:45:18 PST 2017:
Done with file xfer at Sat Jan  7 00:45:20 PST 2017.

Starting file xfer test at Sat Jan  7 00:45:21 PST 2017:
Done with file xfer at Sat Jan  7 00:45:23 PST 2017.

Starting file xfer test at Sat Jan  7 00:45:24 PST 2017:
Done with file xfer at Sat Jan  7 00:45:26 PST 2017.
```

Nothing in syslog at this time.

vnet is alive:
```
donn@invader8:~/workspace/go/src/github.com/platinasystems/go$ sudo goes vnet sh ip fib
[sudo] password for donn:
 Table                   Destination           Adjacency
     0                  10.0.29.0/24  1: glean eth-29-0
     0                  10.0.29.2/32  4: rewrite eth-29-0 IP4: 02:46:8a:00:05:ac -> 02:46:8a:00:06:48
     0                  10.0.29.8/32  2: local eth-29-0
                                        tx pipe packets      10367949796
                                        tx pipe bytes     15307058513083
```

Investigation: Have i8 try to ping i14.

Symptom: i8 cannot reach i14 anymore:
```
donn@invader8:~/workspace/gitlab.com/donnlee/tor/invader/testing/punt_path$ ping 10.0.29.14
PING 10.0.29.14 (10.0.29.14) 56(84) bytes of data.
^C
--- 10.0.29.14 ping statistics ---
2 packets transmitted, 0 received, 100% packet loss, time 1000ms
```

Symptom:  i8 cannot resolve arp for i14 (10.0.29.14):
```
donn@invader8:~/workspace/gitlab.com/donnlee/tor/invader/testing/punt_path$ sudo arp -n
Address                  HWtype  HWaddress           Flags Mask            Iface
192.168.101.2            ether   00:17:cb:80:33:4c   C                     eth0
10.0.29.14                       (incomplete)                              eth-29-0
```

i14 sees the ARP request from i8 and sends a reply:
```
root@invader14-pktgen:~/SWITCH/sdkapp# tcpdump -nni eth1.129 arp
tcpdump: verbose output suppressed, use -v or -vv for full protocol decode
listening on eth1.129, link-type EN10MB (Ethernet), capture size 65535 bytes
11:40:59.856035 ARP, Request who-has 10.0.29.14 tell 10.0.29.8, length 50
11:40:59.856053 ARP, Reply 10.0.29.14 is-at 02:46:8a:00:06:48, length 28
11:41:00.853049 ARP, Request who-has 10.0.29.14 tell 10.0.29.8, length 50
11:41:00.853063 ARP, Reply 10.0.29.14 is-at 02:46:8a:00:06:48, length 28
11:41:01.857032 ARP, Request who-has 10.0.29.14 tell 10.0.29.8, length 50
11:41:01.857046 ARP, Reply 10.0.29.14 is-at 02:46:8a:00:06:48, length 28
11:41:02.862148 ARP, Request who-has 10.0.29.14 tell 10.0.29.8, length 50
11:41:02.862162 ARP, Reply 10.0.29.14 is-at 02:46:8a:00:06:48, length 28
11:41:03.860988 ARP, Request who-has 10.0.29.14 tell 10.0.29.8, length 50
11:41:03.861000 ARP, Reply 10.0.29.14 is-at 02:46:8a:00:06:48, length 28
11:41:04.861036 ARP, Request who-has 10.0.29.14 tell 10.0.29.8, length 50
11:41:04.861048 ARP, Reply 10.0.29.14 is-at 02:46:8a:00:06:48, length 28
```

But reply is never received on i8 x86.

This is i8's view of the ping/arp:
```
donn@invader8:~/workspace/gitlab.com/donnlee/tor/invader/testing/punt_path$ sudo tcpdump -nni eth-29-0 arp
[sudo] password for donn:
tcpdump: verbose output suppressed, use -v or -vv for full protocol decode
listening on eth-29-0, link-type EN10MB (Ethernet), capture size 262144 bytes
11:40:59.738762 ARP, Request who-has 10.0.29.14 tell 10.0.29.8, length 28
11:41:00.735729 ARP, Request who-has 10.0.29.14 tell 10.0.29.8, length 28
11:41:01.739704 ARP, Request who-has 10.0.29.14 tell 10.0.29.8, length 28
11:41:02.744829 ARP, Request who-has 10.0.29.14 tell 10.0.29.8, length 28
```

This tells me the path from i14 to i8 is broken, and I suspect (but have no experience to prove) the arp-reply is dropped in the i8 TH or between i8 TH and i8 x86 punt path.

I've left i8 in this state so a goes coder can do brain surgery on it.
Anyone want to look at this while I have it in this failed state?

**Comment by donnlee** [comment]
With latest code there are fewer occurrences of this issue.
It took 2 days of scp file transfer to hit the unidirectional failure today, and it was in the invader TX direction:
i8_kernel --> vnet --> TH -----> i14

**Comment by donnlee** [comment]
Low pri.
We will worry about this after we move punt-path from pci to 10ge.

**Comment by donnlee** [comment]
I think we moved punt-path from pci to 10GE already ;)   Closing...
