### ISSUE TITLE
ttl=1 packets from i8 fail to arrive at i16's x86

### ISSUE THREAD

**Issue by donnlee** [platinasystems/go#47]
Version:

donn@invader16:~$ /usr/bin/goes version
98f3841b3f6310a316a166d78c519dba9d3e31dd
(today @ 3:27pm)

Symptom:  i8-i16 ping OK.  But BGP between them fails.

What seems to be happening:
* If ttl=64, packet from i8 arrives at i16.
* If ttl=1, packet from i8 does NOT arrive at i16.

This is what i16 sees:
```
17:28:03.976374 IP 10.9.31.8.49567 > 10.9.31.16.179: Flags [S], seq 3153293062, win 25872, options [mss 4312,nop,nop,sackOK,nop,wscale 8], length 0
17:28:03.976492 IP 10.9.31.16.179 > 10.9.31.8.49567: Flags [S.], seq 171549443, ack 3153293063, win 29200, options [mss 1460,nop,nop,sackOK,nop,wscale 8], length 0
17:28:03.976987 IP 10.9.31.8.49567 > 10.9.31.16.179: Flags [.], ack 1, win 102, length 0
17:28:03.977485 IP 10.9.31.16.179 > 10.9.31.8.49567: Flags [F.], seq 1, ack 1, win 115, length 0
17:28:04.183474 IP 10.9.31.16.179 > 10.9.31.8.49567: Flags [F.], seq 1, ack 1, win 115, length 0
17:28:04.391692 IP 10.9.31.16.179 > 10.9.31.8.49567: Flags [F.], seq 1, ack 1, win 115, length 0
17:28:04.815426 IP 10.9.31.16.179 > 10.9.31.8.49567: Flags [F.], seq 1, ack 1, win 115, length 0
17:28:05.643531 IP 10.9.31.16.179 > 10.9.31.8.49567: Flags [F.], seq 1, ack 1, win 115, length 0
17:28:07.307491 IP 10.9.31.16.179 > 10.9.31.8.49567: Flags [F.], seq 1, ack 1, win 115, length 0
17:28:10.607528 IP 10.9.31.16.179 > 10.9.31.8.49567: Flags [F.], seq 1, ack 1, win 115, length 0
^C
16 packets captured
16 packets received by filter
0 packets dropped by kernel
donn@invader16:~$
```

So, i16 sees SYN and ACK packets from i8, and nothing else.

But i8 is sending other packets: Packets with ttl=1 (because this is bgp)

tcpdump on i8 during that same time:

```
17:28:03.921810 IP (tos 0x0, ttl 64, id 3637, offset 0, flags [DF], proto TCP (6), length 52)                                                                                              [77/17919]
    10.9.31.8.49567 > 10.9.31.16.179: Flags [S], cksum 0xbf65 (correct), seq 3153293062, win 25872, options [mss 4312,nop,nop,sackOK,nop,wscale 8], length 0
17:28:03.922628 IP (tos 0x0, ttl 64, id 0, offset 0, flags [DF], proto TCP (6), length 52)
    10.9.31.16.179 > 10.9.31.8.49567: Flags [S.], cksum 0x103c (correct), seq 171549443, ack 3153293063, win 29200, options [mss 1460,nop,nop,sackOK,nop,wscale 8], length 0
17:28:03.922652 IP (tos 0x0, ttl 64, id 3638, offset 0, flags [DF], proto TCP (6), length 40)
    10.9.31.8.49567 > 10.9.31.16.179: Flags [.], cksum 0xc2b9 (correct), ack 1, win 102, length 0
17:28:03.922801 IP (tos 0x0, ttl 1, id 3639, offset 0, flags [DF], proto TCP (6), length 85)
    10.9.31.8.49567 > 10.9.31.16.179: Flags [P.], cksum 0x854f (correct), seq 1:46, ack 1, win 102, length 45: BGP
        Open Message (1), length: 45
          Version 4, my AS 65208, Holdtime 90s, ID 192.168.155.3
          Optional parameters, length: 16
            Option Capabilities Advertisement (2), length: 14
              Route Refresh (2), length: 0
              Multiprotocol Extensions (1), length: 4
                AFI IPv4 (1), SAFI Unicast (1)
              32-Bit AS Number (65), length: 4
                 4 Byte AS 65208
17:28:03.923468 IP (tos 0x0, ttl 64, id 33539, offset 0, flags [DF], proto TCP (6), length 40)
    10.9.31.16.179 > 10.9.31.8.49567: Flags [F.], cksum 0xc2ab (correct), seq 1, ack 1, win 115, length 0
17:28:03.923521 IP (tos 0x0, ttl 1, id 3640, offset 0, flags [DF], proto TCP (6), length 40)
    10.9.31.8.49567 > 10.9.31.16.179: Flags [F.], cksum 0xc28a (correct), seq 46, ack 2, win 102, length 0
17:28:03.932613 IP (tos 0x0, ttl 1, id 3641, offset 0, flags [DF], proto TCP (6), length 40)
    10.9.31.8.49567 > 10.9.31.16.179: Flags [F.], cksum 0xc28a (correct), seq 46, ack 2, win 102, length 0
17:28:04.129577 IP (tos 0x0, ttl 64, id 33540, offset 0, flags [DF], proto TCP (6), length 40)
    10.9.31.16.179 > 10.9.31.8.49567: Flags [F.], cksum 0xc2ab (correct), seq 1, ack 1, win 115, length 0
17:28:04.129587 IP (tos 0x0, ttl 1, id 3642, offset 0, flags [DF], proto TCP (6), length 52)
    10.9.31.8.49567 > 10.9.31.16.179: Flags [.], cksum 0x31f7 (correct), ack 2, win 102, options [nop,nop,sack 1 {1:2}], length 0
17:28:04.337782 IP (tos 0x0, ttl 64, id 33541, offset 0, flags [DF], proto TCP (6), length 40)
    10.9.31.16.179 > 10.9.31.8.49567: Flags [F.], cksum 0xc2ab (correct), seq 1, ack 1, win 115, length 0
17:28:04.337791 IP (tos 0x0, ttl 1, id 3643, offset 0, flags [DF], proto TCP (6), length 52)
    10.9.31.8.49567 > 10.9.31.16.179: Flags [.], cksum 0x31f7 (correct), ack 2, win 102, options [nop,nop,sack 1 {1:2}], length 0
```

Notice at 17:28:03.922801, i8 sends BGP pkt with ttl=1, which never arrives at i16.

Other packets with ttl=1 never arrive at i16.

**Comment by donnlee** [comment]
When I enable bgp multihop with ttl=100 (on i8), the bgp session comes up.

So yeah, confirmed.
```
donn@invader8:~$ gobgp nei
Peer             AS  Up/Down State       |#Advertised Received Accepted
10.9.31.16    65216 00:00:06 Establ      |         47       40       40
10.10.31.17   65217 00:00:40 Establ      |         35       36       36
192.168.155.2 65202 00:00:40 Establ      |         68        0        0
```
10.9.31.16 = i16

**Comment by dlobete** [comment]
Donn,
It was a regression from recent work. We found the problem and I verified
with latest today:

commit c94706c12c41554bf4821169070529015394b942
Author: Eliot Dresselhaus <edressel@platinasystems.com>
Date:   Sat May 13 01:21:22 2017 -0700

    minor

that ttl=1 packets are processed correctly. Please verify.

Don.

**Comment by donnlee** [comment]
Fixed confirmed.  closing.

```
16:49:53.137708 IP (tos 0x0, ttl 1, id 28937, offset 0, flags [DF], proto TCP (6), length 85)
    10.9.31.8.55591 > 10.9.31.16.179: Flags [P.], cksum 0x1e82 (correct), seq 1:46, ack 1, win 102, length 45: BGP
        Open Message (1), length: 45
          Version 4, my AS 65208, Holdtime 90s, ID 192.168.155.3
          Optional parameters, length: 16
            Option Capabilities Advertisement (2), length: 14
              Route Refresh (2), length: 0
              Multiprotocol Extensions (1), length: 4
                AFI IPv4 (1), SAFI Unicast (1)
              32-Bit AS Number (65), length: 4
                 4 Byte AS 65208
