### ISSUE TITLE
goes doesn't understand the redis 'quit' and 'info' commands

### ISSUE THREAD

**Issue by donnlee** [platinasystems/go#49]
goes throws an error when redis client sends the QUIT & INFO commands

https://redis.io/commands/quit

https://redis.io/commands/info

Some redis clients send INFO after the connection is established. These clients see an error response from goes.

The following is a tcpdump showing that goes doesn't understand QUIT:

```
07:45:50.464104 IP 192.168.101.128.6379 > 172.16.3.108.49034: Flags [S.], seq 3664199404, ack 2464616518, win 29200, options [mss 1460,nop,nop,sackOK,nop,wscale 8], length 0
07:45:50.464120 IP 172.16.3.108.49034 > 192.168.101.128.6379: Flags [.], ack 1, win 229, length 0
07:45:50.466959 IP 172.16.3.108.49034 > 192.168.101.128.6379: Flags [P.], seq 1:54, ack 1, win 229, length 53: RESP "hget" "platina" "eeprom.Manufacturer"
07:45:50.468102 IP 192.168.101.128.6379 > 172.16.3.108.49034: Flags [.], ack 54, win 115, length 0
07:45:50.468118 IP 192.168.101.128.6379 > 172.16.3.108.49034: Flags [P.], seq 1:5, ack 54, win 115, length 4: RESP [|RESP]
07:45:50.468123 IP 172.16.3.108.49034 > 192.168.101.128.6379: Flags [.], ack 5, win 229, length 0
07:45:50.468265 IP 192.168.101.128.6379 > 172.16.3.108.49034: Flags [P.], seq 5:14, ack 54, win 115, length 9: RESP "Platina"
07:45:50.468269 IP 172.16.3.108.49034 > 192.168.101.128.6379: Flags [.], ack 14, win 229, length 0
07:45:50.468823 IP 172.16.3.108.49034 > 192.168.101.128.6379: Flags [P.], seq 54:68, ack 14, win 229, length 14: RESP "quit"
07:45:50.469769 IP 192.168.101.128.6379 > 172.16.3.108.49034: Flags [P.], seq 14:46, ack 68, win 115, length 32: RESP "ERROR Method is not supported"
07:45:50.477889 IP 172.16.3.108.49034 > 192.168.101.128.6379: Flags [F.], seq 68, ack 46, win 229, length 0
07:45:50.478751 IP 192.168.101.128.6379 > 172.16.3.108.49034: Flags [P.], seq 46:51, ack 69, win 115, length 5: RESP [|RESP]
07:45:50.478768 IP 172.16.3.108.49034 > 192.168.101.128.6379: Flags [R], seq 2464616586, win 0, length 0
07:45:50.478801 IP 192.168.101.128.6379 > 172.16.3.108.49034: Flags [F.], seq 51, ack 69, win 115, length 0
07:45:50.478805 IP 172.16.3.108.49034 > 192.168.101.128.6379: Flags [R], seq 2464616586, win 0, length 0

**Comment by tgrennan** [comment]
Don, please retest this w/ your redis clients. I added QUIT and INFO. The later doesn't have all of the recommended sections and fields but the spec says that's acceptable.

**Comment by donnlee** [comment]
@tgrennan : INFO is working ok, but QUIT still errors.  invader16 gives me "ERROR QUIT" redis message.

```
donn@vb13:~$ tcpdump -vvnni eth0 port 6379
tcpdump: listening on eth0, link-type EN10MB (Ethernet), capture size 262144 bytes
^[[O23:23:49.667085 IP (tos 0x0, ttl 64, id 33577, offset 0, flags [DF], proto TCP (6), length 60)
    172.16.3.108.50461 > 192.168.101.136.6379: Flags [S], cksum 0xd5db (incorrect -> 0x58e7), seq 64066697, win 29200, options [mss 1460,sackOK,TS val 425203616 ecr 0,nop,wscale 7], length 0
23:23:49.669580 IP (tos 0x0, ttl 63, id 0, offset 0, flags [DF], proto TCP (6), length 60)
    192.168.101.136.6379 > 172.16.3.108.50461: Flags [S.], cksum 0x9133 (correct), seq 2347823732, ack 64066698, win 28960, options [mss 1460,sackOK,TS val 4224601693 ecr 425203616,nop,wscale 8], length 0
23:23:49.669610 IP (tos 0x0, ttl 64, id 33578, offset 0, flags [DF], proto TCP (6), length 52)
    172.16.3.108.50461 > 192.168.101.136.6379: Flags [.], cksum 0xd5d3 (incorrect -> 0x303c), seq 1, ack 1, win 229, options [nop,nop,TS val 425203616 ecr 4224601693], length 0
23:23:49.674083 IP (tos 0x0, ttl 64, id 33579, offset 0, flags [DF], proto TCP (6), length 66)
    172.16.3.108.50461 > 192.168.101.136.6379: Flags [P.], cksum 0xd5e1 (incorrect -> 0xeac3), seq 1:15, ack 1, win 229, options [nop,nop,TS val 425203617 ecr 4224601693], length 14: RESP "info"
23:23:49.675318 IP (tos 0x0, ttl 63, id 55691, offset 0, flags [DF], proto TCP (6), length 52)
    192.168.101.136.6379 > 172.16.3.108.50461: Flags [.], cksum 0x309e (correct), seq 1, ack 15, win 114, options [nop,nop,TS val 4224601695 ecr 425203617], length 0
23:23:49.676435 IP (tos 0x0, ttl 63, id 55692, offset 0, flags [DF], proto TCP (6), length 383)
    192.168.101.136.6379 > 172.16.3.108.50461: Flags [P.], cksum 0x2f6c (correct), seq 1:332, ack 15, win 114, options [nop,nop,TS val 4224601695 ecr 425203617], length 331: RESP "# Server^Jredis_git_sha1: 9ba1dc6558b118c1aad8ef2e95e73d3642351831^Jredis_git_dirty: false^Jos: linux^Jarch_bits: 64^Jprocess_id: 30074^Juptime_in_seconds: 1555^Juptime_in_days: 0^J# Memory^Jused_memory: 4762025984^Jused_memory_rss: 5224^J# Cpu^Jused_cpu_sys: 410ms^Jused_cpu_user: 1.05s^Jused_cpu_sys_children: 0s^Jused_cpu_user_children: 0s^J"
23:23:49.676448 IP (tos 0x0, ttl 64, id 33580, offset 0, flags [DF], proto TCP (6), length 52)
    172.16.3.108.50461 > 192.168.101.136.6379: Flags [.], cksum 0xd5d3 (incorrect -> 0x2ed7), seq 15, ack 332, win 237, options [nop,nop,TS val 425203618 ecr 4224601695], length 0
23:23:49.681892 IP (tos 0x0, ttl 64, id 33581, offset 0, flags [DF], proto TCP (6), length 105)
    172.16.3.108.50461 > 192.168.101.136.6379: Flags [P.], cksum 0xd608 (incorrect -> 0xc67f), seq 15:68, ack 332, win 237, options [nop,nop,TS val 425203619 ecr 4224601695], length 53: RESP "hget" "platina" "eeprom.Manufacturer"
23:23:49.683194 IP (tos 0x0, ttl 63, id 55693, offset 0, flags [DF], proto TCP (6), length 56)
    192.168.101.136.6379 > 172.16.3.108.50461: Flags [P.], cksum 0xfdcc (correct), seq 332:336, ack 68, win 114, options [nop,nop,TS val 4224601697 ecr 425203619], length 4: RESP [|RESP]
23:23:49.683214 IP (tos 0x0, ttl 63, id 55694, offset 0, flags [DF], proto TCP (6), length 59)
    192.168.101.136.6379 > 172.16.3.108.50461: Flags [P.], cksum 0xb2b7 (correct), seq 336:343, ack 68, win 114, options [nop,nop,TS val 4224601697 ecr 425203619], length 7: RESP [|RESP]
23:23:49.683223 IP (tos 0x0, ttl 63, id 55695, offset 0, flags [DF], proto TCP (6), length 54)
    192.168.101.136.6379 > 172.16.3.108.50461: Flags [P.], cksum 0x21fb (correct), seq 343:345, ack 68, win 114, options [nop,nop,TS val 4224601697 ecr 425203619], length 2: RESP [|RESP]
23:23:49.683532 IP (tos 0x0, ttl 64, id 33582, offset 0, flags [DF], proto TCP (6), length 66)
    172.16.3.108.50461 > 192.168.101.136.6379: Flags [P.], cksum 0xd5e1 (incorrect -> 0xde0d), seq 68:82, ack 345, win 237, options [nop,nop,TS val 425203620 ecr 4224601697], length 14: RESP "quit"
23:23:49.685277 IP (tos 0x0, ttl 63, id 55696, offset 0, flags [DF], proto TCP (6), length 65)
    192.168.101.136.6379 > 172.16.3.108.50461: Flags [P.], cksum 0x8c57 (correct), seq 345:358, ack 82, win 114, options [nop,nop,TS val 4224601697 ecr 425203620], length 13: RESP "ERROR QUIT"
23:23:49.692967 IP (tos 0x0, ttl 64, id 33583, offset 0, flags [DF], proto TCP (6), length 52)
    172.16.3.108.50461 > 192.168.101.136.6379: Flags [F.], cksum 0xd5d3 (incorrect -> 0x2e73), seq 82, ack 358, win 237, options [nop,nop,TS val 425203622 ecr 4224601697], length 0
23:23:49.693600 IP (tos 0x0, ttl 63, id 55697, offset 0, flags [DF], proto TCP (6), length 57)
    192.168.101.136.6379 > 172.16.3.108.50461: Flags [P.], cksum 0xa852 (correct), seq 358:363, ack 83, win 114, options [nop,nop,TS val 4224601700 ecr 425203622], length 5: RESP [|RESP]
23:23:49.693630 IP (tos 0x0, ttl 64, id 37973, offset 0, flags [DF], proto TCP (6), length 40)
    172.16.3.108.50461 > 192.168.101.136.6379: Flags [R], cksum 0x637d (correct), seq 64066780, win 0, length 0
23:23:49.693653 IP (tos 0x0, ttl 63, id 55698, offset 0, flags [DF], proto TCP (6), length 52)
    192.168.101.136.6379 > 172.16.3.108.50461: Flags [F.], cksum 0x2ee5 (correct), seq 363, ack 83, win 114, options [nop,nop,TS val 4224601700 ecr 425203622], length 0
23:23:49.693658 IP (tos 0x0, ttl 64, id 37974, offset 0, flags [DF], proto TCP (6), length 40)
    172.16.3.108.50461 > 192.168.101.136.6379: Flags [R], cksum 0x637d (correct), seq 64066780, win 0, length 0
^[[I



^C
18 packets captured
18 packets received by filter
0 packets dropped by kernel
donn@vb13:~$
```

i16:
```
donn@invader16:~/workspace/docker/gobgp$ goes show-packages | egrep "version:"
    version: 9ba1dc6558b118c1aad8ef2e95e73d3642351831
    version: d0e64c647b86e234434f7bdf55ba52df777bb261
    version: a7405309d5953fa8e08096613db1e27400fc4a8a
```


My script for the test:

```
donn@vb13:~/workspace/gitlab.com/donnlee/tile/server$ node 1st_redis.js
Getting key: eeprom.Manufacturer
Reply: Platina
Error: ReplyError: ERROR QUIT
```

**Comment by donnlee** [comment]
using redis-client, the client doesn't send a redis "QUIT" message on the wire.  Client just FIN's the connection:

```
donn@invader8:~$ tcpdump -nni eth0 port 6379
tcpdump: verbose output suppressed, use -v or -vv for full protocol decode
listening on eth0, link-type EN10MB (Ethernet), capture size 262144 bytes
15:47:19.146360 IP 192.168.101.128.59928 > 192.168.101.136.6379: Flags [S], seq 477945340, win 29200, options [mss 1460,sackOK,TS val 18863088 ecr 0,nop,wscale 8], length 0
15:47:19.146554 IP 192.168.101.136.6379 > 192.168.101.128.59928: Flags [S.], seq 1158620883, ack 477945341, win 28960, options [mss 1460,sackOK,TS val 2269360207 ecr 18863088,nop,wscale 8], length 0
15:47:19.146573 IP 192.168.101.128.59928 > 192.168.101.136.6379: Flags [.], ack 1, win 115, options [nop,nop,TS val 18863088 ecr 2269360207], length 0
15:47:21.081358 IP 192.168.101.128.59928 > 192.168.101.136.6379: Flags [P.], seq 1:15, ack 1, win 115, options [nop,nop,TS val 18863572 ecr 2269360207], length 14: RESP "info"
15:47:21.081574 IP 192.168.101.136.6379 > 192.168.101.128.59928: Flags [.], ack 15, win 114, options [nop,nop,TS val 2269360691 ecr 18863572], length 0
15:47:21.082389 IP 192.168.101.136.6379 > 192.168.101.128.59928: Flags [P.], seq 1:332, ack 15, win 114, options [nop,nop,TS val 2269360691 ecr 18863572], length 331: RESP "# Server^Jredis_git_sha1: 9ba1dc6558b118c1aad8ef2e95e73d3642351831^Jredis_git_dirty: false^Jos: linux^Jarch_bits: 64^Jprocess_id: 30074^Juptime_in_seconds: 2578^Juptime_in_days: 0^J# Memory^Jused_memory: 4773666816^Jused_memory_rss: 6646^J# Cpu^Jused_cpu_sys: 1.14s^Jused_cpu_user: 2.15s^Jused_cpu_sys_children: 0s^Jused_cpu_user_children: 0s^J"
15:47:21.082413 IP 192.168.101.128.59928 > 192.168.101.136.6379: Flags [.], ack 332, win 119, options [nop,nop,TS val 18863572 ecr 2269360691], length 0
15:47:22.169139 IP 192.168.101.128.59928 > 192.168.101.136.6379: Flags [F.], seq 15, ack 332, win 119, options [nop,nop,TS val 18863844 ecr 2269360691], length 0
15:47:22.169345 IP 192.168.101.136.6379 > 192.168.101.128.59928: Flags [P.], seq 332:337, ack 16, win 114, options [nop,nop,TS val 2269360963 ecr 18863844], length 5: RESP [|RESP]
15:47:22.169369 IP 192.168.101.128.59928 > 192.168.101.136.6379: Flags [R], seq 477945356, win 0, length 0
15:47:22.169372 IP 192.168.101.136.6379 > 192.168.101.128.59928: Flags [F.], seq 337, ack 16, win 114, options [nop,nop,TS val 2269360963 ecr 18863844], length 0
15:47:22.169377 IP 192.168.101.128.59928 > 192.168.101.136.6379: Flags [R], seq 477945356, win 0, length 0
```

Note, that the command "QUIT" never appears above.  But "INFO" does (and works ok).

**Comment by stigt** [comment]
Info and quit have been implemented.
```
stig@invader11:~$ redis-cli -h 192.168.101.121
192.168.101.121:6379> info
# Server
redis_git_sha1: 9a710529427cb43a79b64cb68504394725607be0
redis_git_dirty: true
os: linux
arch_bits: 64
process_id: 14382
uptime_in_seconds: 722
uptime_in_days: 0

# Memory
used_memory: 5011570688
used_memory_rss: 6009

# Cpu
used_cpu_sys: 160ms
used_cpu_user: 400ms
used_cpu_sys_children: 0s
used_cpu_user_children: 0s
192.168.101.121:6379> quit
stig@invader11:~$ 

```
