### ISSUE TITLE
linux arp times out since tomahawk is doing the forwarding

### ISSUE THREAD

**Issue by stigt** [platinasystems/go#108]
Calsoft noted that when running ansible playbooks/vlan/vlan_configuration_on_transit_vlan_interfaces.yml that they were seeing traffic with tcpdump that should've been forwarded by tomahawk.  I believe this is due to arp entries timing out and vnet gets the netlink message to remove the neighbor.  If linux was doing the forwarding then I believe the arp entry timeout gets reset for every packet and therefore does not timeout the arp entry while in use.

The linux default arp timeout appears to be 60 seconds:
```
stig@invader1:~$ cat /proc/sys/net/ipv4/neigh/default/gc_stale_time
60
```
Not sure if tomahawk keeps track of when an adjacency was last used so that the netlink messages can be ignored.

**Comment by jignesh045** [comment]
Issue verification status: Verified

Issue status: Failed

Issue verified in below build

```
root@invader44:/# goes version
github.com/platinasystems/go: v0.41-313-g96fcd2e1
github.com/platinasystems/fe1: v0.2-526-gaa6b634
github.com/platinasystems/firmware-fe1a: v0.2
root@invader44:/#
root@invader44:/# goes hget platina-mk1 packages | grep version:
    version: 96fcd2e13b9d751a95eda8faa60e4974e8143765
    version: aa6b634a0548a66703fd379e26677c12263f752a
    version: 60f39141fbbf78ddb2260dba74c68f2789374f18
root@invader44:/#
root@invader44:/#
root@invader44:/# dpkg --list | grep kernel
ii  kmod                           18-3                             amd64        tools for managing Linux kernel modules
ii  libdrm2:amd64                  2.4.58-2                         amd64        Userspace interface to kernel DRM services -- runtime
ii  linux-image-4.13.0-platina-mk1 4.13-129-g34f08d37ef9c           amd64        Linux kernel, version 4.13.0-platina-mk1
ii  rsyslog                        8.4.2-1+deb8u2                   amd64        reliable system and kernel logging daemon
root@invader44:/#
```
Steps: 

1) Testing ARP request-reply between Inv44 to Inv42 (using eth-3-1 interface, directly connected)

```
root@invader44:/# ifconfig eth-3-1
eth-3-1   Link encap:Ethernet  HWaddr 50:18:4c:00:06:2c
          inet addr:10.0.3.30  Bcast:10.0.3.255  Mask:255.255.255.0
          inet6 addr: fe80::5218:4cff:fe00:62c/64 Scope:Link
          UP BROADCAST RUNNING MULTICAST  MTU:1500  Metric:1
          RX packets:2 errors:0 dropped:0 overruns:0 frame:0
          TX packets:2 errors:0 dropped:0 overruns:0 carrier:0
          collisions:0 txqueuelen:1000
          RX bytes:268 (268.0 B)  TX bytes:268 (268.0 B)

root@invader44:/#

root@invader44:/# cat /proc/sys/net/ipv4/neigh/default/gc_stale_time
60
root@invader44:/#

root@invader42:/# ifconfig eth-3-1
eth-3-1   Link encap:Ethernet  HWaddr 50:18:4c:00:0e:6c
          inet addr:10.0.3.32  Bcast:10.0.3.255  Mask:255.255.255.0
          inet6 addr: fe80::5218:4cff:fe00:e6c/64 Scope:Link
          UP BROADCAST RUNNING MULTICAST  MTU:1500  Metric:1
          RX packets:2 errors:0 dropped:0 overruns:0 frame:0
          TX packets:2 errors:0 dropped:0 overruns:0 carrier:0
          collisions:0 txqueuelen:1000
          RX bytes:268 (268.0 B)  TX bytes:268 (268.0 B)

root@invader42:/#

root@invader42:/# cat /proc/sys/net/ipv4/neigh/default/gc_stale_time
60
root@invader42:/#
```

2) Initiated ping for 60 packets (around 1 min) & observed arp request & reply in both invaders.

```
root@invader44:/# ping 10.0.3.32
PING 10.0.3.32 (10.0.3.32) 56(84) bytes of data.
64 bytes from 10.0.3.32: icmp_seq=1 ttl=64 time=1.33 ms
64 bytes from 10.0.3.32: icmp_seq=2 ttl=64 time=0.171 ms
...
...
64 bytes from 10.0.3.32: icmp_seq=59 ttl=64 time=0.241 ms
64 bytes from 10.0.3.32: icmp_seq=60 ttl=64 time=0.186 ms
64 bytes from 10.0.3.32: icmp_seq=61 ttl=64 time=0.222 ms
^C
--- 10.0.3.32 ping statistics ---
61 packets transmitted, 61 received, 0% packet loss, time 61414ms
rtt min/avg/max/mdev = 0.107/0.221/1.335/0.149 ms
root@invader44:/#

root@invader44:/# tcpdump -i eth-3-1
tcpdump: verbose output suppressed, use -v or -vv for full protocol decode
listening on eth-3-1, link-type EN10MB (Ethernet), capture size 262144 bytes
23:27:34.760340 ARP, Request who-has 10.0.3.32 tell 10.0.3.30, length 28
23:27:34.761581 ARP, Reply 10.0.3.32 is-at 50:18:4c:00:0e:6c (oui Unknown), length 50
23:27:34.761590 IP 10.0.3.30 > 10.0.3.32: ICMP echo request, id 22566, seq 1, length 64
23:27:34.761653 IP 10.0.3.32 > 10.0.3.30: ICMP echo reply, id 22566, seq 1, length 64
...
...
23:27:39.854651 IP 10.0.3.30 > 10.0.3.32: ICMP echo request, id 22566, seq 6, length 64
23:27:39.854883 IP 10.0.3.32 > 10.0.3.30: ICMP echo reply, id 22566, seq 6, length 64
23:27:39.877702 ARP, Request who-has 10.0.3.30 tell 10.0.3.32, length 50
23:27:39.877712 ARP, Reply 10.0.3.30 is-at 50:18:4c:00:06:2c (oui Unknown), length 28
23:27:40.878661 IP 10.0.3.30 > 10.0.3.32: ICMP echo request, id 22566, seq 7, length 64
23:27:40.878814 IP 10.0.3.32 > 10.0.3.30: ICMP echo reply, id 22566, seq 7, length 64
...
...
23:28:06.482634 IP 10.0.3.30 > 10.0.3.32: ICMP echo request, id 22566, seq 32, length 64
23:28:06.482826 IP 10.0.3.32 > 10.0.3.30: ICMP echo reply, id 22566, seq 32, length 64
23:28:06.501408 ARP, Request who-has 10.0.3.30 tell 10.0.3.32, length 50
23:28:06.501421 ARP, Reply 10.0.3.30 is-at 50:18:4c:00:06:2c (oui Unknown), length 28
23:28:07.502615 IP 10.0.3.30 > 10.0.3.32: ICMP echo request, id 22566, seq 33, length 64
23:28:07.502715 IP 10.0.3.32 > 10.0.3.30: ICMP echo reply, id 22566, seq 33, length 64
...
...
23:28:33.102661 IP 10.0.3.30 > 10.0.3.32: ICMP echo request, id 22566, seq 58, length 64
23:28:33.102857 IP 10.0.3.32 > 10.0.3.30: ICMP echo reply, id 22566, seq 58, length 64
23:28:33.125548 ARP, Request who-has 10.0.3.30 tell 10.0.3.32, length 50
23:28:33.125559 ARP, Reply 10.0.3.30 is-at 50:18:4c:00:06:2c (oui Unknown), length 28
23:28:34.126663 IP 10.0.3.30 > 10.0.3.32: ICMP echo request, id 22566, seq 59, length 64
23:28:34.126873 IP 10.0.3.32 > 10.0.3.30: ICMP echo reply, id 22566, seq 59, length 64
23:28:35.150644 IP 10.0.3.30 > 10.0.3.32: ICMP echo request, id 22566, seq 60, length 64
23:28:35.150802 IP 10.0.3.32 > 10.0.3.30: ICMP echo reply, id 22566, seq 60, length 64
23:28:36.174661 IP 10.0.3.30 > 10.0.3.32: ICMP echo request, id 22566, seq 61, length 64
23:28:36.174850 IP 10.0.3.32 > 10.0.3.30: ICMP echo reply, id 22566, seq 61, length 64
^C
130 packets captured
130 packets received by filter
0 packets dropped by kernel
root@invader44:/#

root@invader42:/# tcpdump -i eth-3-1
tcpdump: verbose output suppressed, use -v or -vv for full protocol decode
listening on eth-3-1, link-type EN10MB (Ethernet), capture size 262144 bytes
23:27:34.759499 ARP, Request who-has 10.0.3.32 tell 10.0.3.30, length 50
23:27:34.759523 ARP, Reply 10.0.3.32 is-at 50:18:4c:00:0e:6c (oui Unknown), length 28
23:27:34.759807 IP 10.0.3.30 > 10.0.3.32: ICMP echo request, id 22566, seq 1, length 64
23:27:34.759829 IP 10.0.3.32 > 10.0.3.30: ICMP echo reply, id 22566, seq 1, length 64
...
...
23:27:39.852936 IP 10.0.3.30 > 10.0.3.32: ICMP echo request, id 22566, seq 6, length 64
23:27:39.852975 IP 10.0.3.32 > 10.0.3.30: ICMP echo reply, id 22566, seq 6, length 64
23:27:39.875505 ARP, Request who-has 10.0.3.30 tell 10.0.3.32, length 28
23:27:39.887521 ARP, Reply 10.0.3.30 is-at 50:18:4c:00:06:2c (oui Unknown), length 50
23:27:40.876966 IP 10.0.3.30 > 10.0.3.32: ICMP echo request, id 22566, seq 7, length 64
23:27:40.876994 IP 10.0.3.32 > 10.0.3.30: ICMP echo reply, id 22566, seq 7, length 64
...
...
23:28:06.480950 IP 10.0.3.30 > 10.0.3.32: ICMP echo request, id 22566, seq 32, length 64
23:28:06.480996 IP 10.0.3.32 > 10.0.3.30: ICMP echo reply, id 22566, seq 32, length 64
23:28:06.499487 ARP, Request who-has 10.0.3.30 tell 10.0.3.32, length 28
23:28:06.499815 ARP, Reply 10.0.3.30 is-at 50:18:4c:00:06:2c (oui Unknown), length 50
23:28:07.500882 IP 10.0.3.30 > 10.0.3.32: ICMP echo request, id 22566, seq 33, length 64
23:28:07.500925 IP 10.0.3.32 > 10.0.3.30: ICMP echo reply, id 22566, seq 33, length 64
...
...
23:28:33.101013 IP 10.0.3.30 > 10.0.3.32: ICMP echo request, id 22566, seq 58, length 64
23:28:33.101051 IP 10.0.3.32 > 10.0.3.30: ICMP echo reply, id 22566, seq 58, length 64
23:28:33.123510 ARP, Request who-has 10.0.3.30 tell 10.0.3.32, length 28
23:28:33.123951 ARP, Reply 10.0.3.30 is-at 50:18:4c:00:06:2c (oui Unknown), length 50
23:28:34.125017 IP 10.0.3.30 > 10.0.3.32: ICMP echo request, id 22566, seq 59, length 64
23:28:34.125073 IP 10.0.3.32 > 10.0.3.30: ICMP echo reply, id 22566, seq 59, length 64
23:28:35.148991 IP 10.0.3.30 > 10.0.3.32: ICMP echo request, id 22566, seq 60, length 64
23:28:35.149029 IP 10.0.3.32 > 10.0.3.30: ICMP echo reply, id 22566, seq 60, length 64
23:28:36.173002 IP 10.0.3.30 > 10.0.3.32: ICMP echo request, id 22566, seq 61, length 64
23:28:36.173036 IP 10.0.3.32 > 10.0.3.30: ICMP echo reply, id 22566, seq 61, length 64
^C
130 packets captured
130 packets received by filter
0 packets dropped by kernel
root@invader42:/#
```
3) Observed ARP entries in both invaders

```
root@invader44:/# arp -a
? (10.0.3.32) at 50:18:4c:00:0e:6c [ether] on eth-3-1
? (172.17.2.1) at 10:0e:7e:fd:ec:88 [ether] on eth0
? (172.17.2.29) at 50:18:4c:00:05:9d [ether] on eth0
? (172.17.2.28) at 50:18:4c:00:10:71 [ether] on eth0
root@invader44:/#

root@invader42:/# arp -a
? (172.17.2.1) at 10:0e:7e:fd:ec:88 [ether] on eth0
? (172.17.2.29) at 50:18:4c:00:05:9d [ether] on eth0
? (172.17.2.28) at 50:18:4c:00:10:71 [ether] on eth0
? (10.0.3.30) at 50:18:4c:00:06:2c [ether] on eth-3-1
root@invader42:/#
```
4) Again initiated ping (after they have arp entries) for 60 packets (around 1 min) & observed arp request-reply in both invaders.

```
root@invader44:/# ping 10.0.3.32
PING 10.0.3.32 (10.0.3.32) 56(84) bytes of data.
64 bytes from 10.0.3.32: icmp_seq=1 ttl=64 time=0.223 ms
64 bytes from 10.0.3.32: icmp_seq=2 ttl=64 time=0.247 ms
64 bytes from 10.0.3.32: icmp_seq=3 ttl=64 time=0.221 ms
...
...
64 bytes from 10.0.3.32: icmp_seq=58 ttl=64 time=0.143 ms
64 bytes from 10.0.3.32: icmp_seq=59 ttl=64 time=0.185 ms
64 bytes from 10.0.3.32: icmp_seq=60 ttl=64 time=0.198 ms
^C
--- 10.0.3.32 ping statistics ---
60 packets transmitted, 60 received, 0% packet loss, time 60394ms
rtt min/avg/max/mdev = 0.131/0.205/0.266/0.037 ms
root@invader44:/#

root@invader44:/# tcpdump -i eth-3-1
tcpdump: verbose output suppressed, use -v or -vv for full protocol decode
listening on eth-3-1, link-type EN10MB (Ethernet), capture size 262144 bytes
23:32:04.612647 IP 10.0.3.30 > 10.0.3.32: ICMP echo request, id 22569, seq 1, length 64
23:32:04.612848 IP 10.0.3.32 > 10.0.3.30: ICMP echo reply, id 22569, seq 1, length 64
...
...
23:32:08.686651 IP 10.0.3.30 > 10.0.3.32: ICMP echo request, id 22569, seq 5, length 64
23:32:08.686845 IP 10.0.3.32 > 10.0.3.30: ICMP echo reply, id 22569, seq 5, length 64
23:32:09.701264 ARP, Request who-has 10.0.3.30 tell 10.0.3.32, length 50
23:32:09.701275 ARP, Reply 10.0.3.30 is-at 50:18:4c:00:06:2c (oui Unknown), length 28
23:32:09.710657 IP 10.0.3.30 > 10.0.3.32: ICMP echo request, id 22569, seq 6, length 64
23:32:09.710811 IP 10.0.3.32 > 10.0.3.30: ICMP echo reply, id 22569, seq 6, length 64
...
...
23:32:50.670660 IP 10.0.3.30 > 10.0.3.32: ICMP echo request, id 22569, seq 46, length 64
23:32:50.670869 IP 10.0.3.32 > 10.0.3.30: ICMP echo reply, id 22569, seq 46, length 64
23:32:51.685340 ARP, Request who-has 10.0.3.30 tell 10.0.3.32, length 50
23:32:51.685350 ARP, Reply 10.0.3.30 is-at 50:18:4c:00:06:2c (oui Unknown), length 28
23:32:51.694645 IP 10.0.3.30 > 10.0.3.32: ICMP echo request, id 22569, seq 47, length 64
23:32:51.694748 IP 10.0.3.32 > 10.0.3.30: ICMP echo reply, id 22569, seq 47, length 64
...
...
23:33:05.006651 IP 10.0.3.30 > 10.0.3.32: ICMP echo request, id 22569, seq 60, length 64
23:33:05.006836 IP 10.0.3.32 > 10.0.3.30: ICMP echo reply, id 22569, seq 60, length 64
^C
124 packets captured
124 packets received by filter
0 packets dropped by kernel
root@invader44:/#

root@invader42:/# tcpdump -i eth-3-1
tcpdump: verbose output suppressed, use -v or -vv for full protocol decode
listening on eth-3-1, link-type EN10MB (Ethernet), capture size 262144 bytes
23:32:04.611212 IP 10.0.3.30 > 10.0.3.32: ICMP echo request, id 22569, seq 1, length 64
23:32:04.611273 IP 10.0.3.32 > 10.0.3.30: ICMP echo reply, id 22569, seq 1, length 64
...
...
23:32:08.685225 IP 10.0.3.30 > 10.0.3.32: ICMP echo request, id 22569, seq 5, length 64
23:32:08.685263 IP 10.0.3.32 > 10.0.3.30: ICMP echo reply, id 22569, seq 5, length 64
23:32:09.699505 ARP, Request who-has 10.0.3.30 tell 10.0.3.32, length 28
23:32:09.699841 ARP, Reply 10.0.3.30 is-at 50:18:4c:00:06:2c (oui Unknown), length 50
23:32:09.709212 IP 10.0.3.30 > 10.0.3.32: ICMP echo request, id 22569, seq 6, length 64
23:32:09.709256 IP 10.0.3.32 > 10.0.3.30: ICMP echo reply, id 22569, seq 6, length 64
...
...
23:32:50.669279 IP 10.0.3.30 > 10.0.3.32: ICMP echo request, id 22569, seq 46, length 64
23:32:50.669325 IP 10.0.3.32 > 10.0.3.30: ICMP echo reply, id 22569, seq 46, length 64
23:32:51.683527 ARP, Request who-has 10.0.3.30 tell 10.0.3.32, length 28
23:32:51.684077 ARP, Reply 10.0.3.30 is-at 50:18:4c:00:06:2c (oui Unknown), length 50
23:32:51.693212 IP 10.0.3.30 > 10.0.3.32: ICMP echo request, id 22569, seq 47, length 64
23:32:51.693245 IP 10.0.3.32 > 10.0.3.30: ICMP echo reply, id 22569, seq 47, length 64
...
...
23:33:05.005272 IP 10.0.3.30 > 10.0.3.32: ICMP echo request, id 22569, seq 60, length 64
23:33:05.005310 IP 10.0.3.32 > 10.0.3.30: ICMP echo reply, id 22569, seq 60, length 64
^C
124 packets captured
124 packets received by filter
0 packets dropped by kernel
root@invader42:/#
```
5. In both case, i noticed that the inv42 has generated ARP request more than 1 count which should be expected if we have default arp timeout to be 60 seconds.
